"id","name","description","website","established","isOrganic","images__icon","images__medium","images__large","status","statusDisplay","createDate","updateDate","streetAddress","extendedAddress","locality","region","postalCode","phone","hoursOfOperation","latitude","longitude","isPrimary","inPlanning","isClosed","openToPublic","locationType","locationTypeDisplay","countryIsoCode","yearOpened","displayName","isoThree","numberCode","mailingListUrl","yearClosed","currentPage","numberOfPages","totalResults"
"1Y8Ay5","Wildlife Brewing and Pizza","Wildlife Brewing and Pizza was founded in 2003 by Owner & Head Brewer Ric Harmon. Since then we have been serving up Award-Winning Micro Brews, Tasty Pizza Creations, and delivering Great Service.","http://wildlifebrewing.com/","2003","N","","","","verified","Verified","2012-01-03 02:41:33","2014-07-23 19:11:34","","PO Box 869","Victor","Idaho","","208-787-2623","","43.59998","-111.111374","Y","N","N","Y","brewpub","Brewpub","US","","United States","USA","","","","","",""
"okwu8a","Wildwood Brewing","Wildwood Brewery is a organic craft brewery in Western Montana committed to building an integrated brewing/farming system where all wastes are used as value-added input.","http://wildwoodbrewing.com/","2012","N","","","","verified","Verified","2012-01-03 02:41:33","2014-07-23 19:11:34","4018 US Hwy 93 North","","Stevensville","Montana","59870","(406) 777-2855","Mon - Sun: 4:00 pm - 8:00 pm","46.53121","-114.110864","Y","N","N","Y","micro","Micro Brewery","US","2012","United States","USA","","","","","",""
"KAEeiz","Wiley Brewing Company","Wiley Brewing Company is a ""Genius"" entrepreneurial brewery in the early stages of development. Specialities include ""Estate"" and ""Big"" brews for the courageous beer drinker.","http://www.wileybrewing.com/","2009","N","https://s3.amazonaws.com/brewerydbapi/brewery/P8CiOe/upload_JKWTgp-icon.png","https://s3.amazonaws.com/brewerydbapi/brewery/P8CiOe/upload_JKWTgp-medium.png","https://s3.amazonaws.com/brewerydbapi/brewery/P8CiOe/upload_JKWTgp-large.png","verified","Verified","2012-01-03 02:41:33","2014-07-23 19:11:34","","","Thornton","Colorado","","(970) 691-1641","","39.8680412","-104.9719243","Y","Y","N","Y","micro","Micro Brewery","US","","United States","USA","","","","","",""
"F7jYQV","Wiley Roots Brewing Company","Wiley Roots Brewing Company is a small, artisan craft brewery that opened in Greeley, Colorado in June of 2013.","http://www.wileyrootsbrewing.com/","2009","N","https://s3.amazonaws.com/brewerydbapi/brewery/czwGMM/upload_SHHFtv-icon.png","https://s3.amazonaws.com/brewerydbapi/brewery/czwGMM/upload_SHHFtv-medium.png","https://s3.amazonaws.com/brewerydbapi/brewery/czwGMM/upload_SHHFtv-large.png","verified","Verified","2012-01-03 02:41:33","2014-07-23 19:11:34","625 3rd Street","Unit D","Greeley","Colorado","80631","(970) 691-1641","Wed - Fri: 3:00 pm - 11:00 pm  Sat: 2:00 pm - 11:00 pm  Sun: 2:00 pm - 8:00 pm","40.4315603","-104.6879537","Y","N","N","Y","micro","Micro Brewery","US","","United States","USA","","","","","",""
"drqz7W","William Kuether Brewing","","","","N","","","","verified","Verified","2012-01-03 02:41:33","2014-08-23 16:38:30","","","Clear Lake","Wisconsin","","","","45.2519072","-92.2712996","Y","N","Y","N","micro","Micro Brewery","US","","United States","USA","","","","","",""
"ZpN7KQ","Main Cidery","","http://www.sunshineimports.com/products","","N","","","","verified","Verified","2012-01-03 02:41:33","2014-07-23 19:11:34","","","Ledbury","Herefordshire","HR8 1LG","","","52.0477821","-2.4288444","Y","N","N","Y","micro","Micro Brewery","GB","","United Kingdom","GBR","826","","","","",""
"GBZnGx","Williams Brothers Brewing Company","Scottish Craft Beer - Microbrewed For Maximum Flavour. A brotherhood of brewers, creating unique beers while enjoying life beyond the mash tun. Creating & selling exciting new & historical brews worldwide.","http://www.williamsbrosbrew.com","1990","N","https://s3.amazonaws.com/brewerydbapi/brewery/qqxm2J/upload_K1b6v6-icon.png","https://s3.amazonaws.com/brewerydbapi/brewery/qqxm2J/upload_K1b6v6-medium.png","https://s3.amazonaws.com/brewerydbapi/brewery/qqxm2J/upload_K1b6v6-large.png","verified","Verified","2012-01-03 02:41:33","2014-07-23 19:11:34","New Alloa Brewery, Kelliebank","","Alloa","Scotland","FK10 1NT","44-(01259)-725511","","56.11632","-3.795194","Y","N","N","Y","micro","Micro Brewery","GB","1990","United Kingdom","GBR","826","","","","",""
"sVIbQO","Williamsburg AleWerks","Williamsburg AleWerks is located in the heart of the early colonies in Williamsburg, Virginia. Established in 2006 we have rolled out a broad range of beer offerings and quickly established a reputation for fine beer. We operate a direct fired brick-clad Peter Austin brew house and ferment all our beers in state-of-the-art conical fermentors.","http://www.williamsburgalewerks.com/","2006","N","https://s3.amazonaws.com/brewerydbapi/brewery/2ONHw4/upload_fyDzSa-icon.png","https://s3.amazonaws.com/brewerydbapi/brewery/2ONHw4/upload_fyDzSa-medium.png","https://s3.amazonaws.com/brewerydbapi/brewery/2ONHw4/upload_fyDzSa-large.png","verified","Verified","2012-01-03 02:41:33","2014-07-23 19:11:34","189-B Ewell Road","","Williamsburg","Virginia","23188","757-220-3670","","37.3207221","-76.7324337","Y","N","N","Y","micro","Micro Brewery","US","2006","United States","USA","","","","","",""
"Up1PZp","Willimantic Brewing Company","Our original Main Street Café was founded in 1991, and began operations as a small deli in the old Capitol Theatre building on Main Street in Willimantic, CT. Occupying both the lobby and concession area of the theatre, seating was limited to 50 people. After 3 years we were bursting at the seams and made the move to 877 Main Street, another historic building. There we expanded to a full service restaurant and featured American craft-brewed beers and an extensive menu.","http://willibrew.com/","1991","N","https://s3.amazonaws.com/brewerydbapi/brewery/6r5pyg/upload_rJ7cww-icon.png","https://s3.amazonaws.com/brewerydbapi/brewery/6r5pyg/upload_rJ7cww-medium.png","https://s3.amazonaws.com/brewerydbapi/brewery/6r5pyg/upload_rJ7cww-large.png","verified","Verified","2012-01-03 02:41:33","2014-09-26 14:00:29","967 Main Street","","Willimantic","Connecticut","06226","860-423-6777","Sunday: 11:30 AM - 1:00 AM  Monday: 4:00 PM - 1:00 AM  Tuesday: 11:30 AM - 1:00 AM  Wednesday: 11:30 AM - 1:00 AM  Thursday: 11:30 AM - 1:00 AM  Friday: 11:30 AM - 2:00 AM  Saturday: 11:30 AM - 2:00 AM","41.7128629","-72.2172641","Y","N","N","Y","brewpub","Brewpub","US","1991","United States","USA","","http://willibrew.com/mailing_list.htm","","","",""
"ZsiKum","Willinger Brauhaus","","http://www.willinger-brauhaus.de/","1988","N","","","","verified","Verified","2012-01-03 02:41:33","2014-07-23 19:11:34","In den Kämpen 2","","Willingen","Hesse","34508","","","51.294358","8.604748","Y","N","N","Y","brewpub","Brewpub","DE","","Germany","DEU","276","","","","",""
"78kDjG","Willoughby Brewing Company","Serving the best food and craft beer in Lake County, featuring live entertainment 3 nights per week in an amazing atmosphere. Come see what's brewing!!","http://willoughbybrewing.com/","1998","N","https://s3.amazonaws.com/brewerydbapi/brewery/TAgaBk/upload_jVU3M9-icon.png","https://s3.amazonaws.com/brewerydbapi/brewery/TAgaBk/upload_jVU3M9-medium.png","https://s3.amazonaws.com/brewerydbapi/brewery/TAgaBk/upload_jVU3M9-large.png","verified","Verified","2012-01-03 02:41:33","2014-07-23 19:11:34","4057 Erie St.","","Willoughby","Ohio","44094","440-975-0202","Mon - Wed: 11:00 am - 11:00 pm  Thu - Sat:	11:00 am - 2:00 am  Sun:	11:00 am - 11:00 pm","41.641386","-81.406621","Y","N","N","Y","micro","Micro Brewery","US","","United States","USA","","","","","",""
"jST1sh","Wilmington Brewing","","","1994","N","","","","verified","Verified","2012-01-03 02:41:33","2014-07-23 19:11:34","111 Bryan Road","","Wilmington","North Carolina","28412","","","34.170868","-77.946875","Y","N","Y","N","micro","Micro Brewery","US","1994","United States","USA","","","1997","","",""
"LmBq28","Wiltse's Brew Pub and Family Restaurant","","http://wiltsebrewpub.com/","","N","https://s3.amazonaws.com/brewerydbapi/brewery/jAoe87/upload_KQulGv-icon.png","https://s3.amazonaws.com/brewerydbapi/brewery/jAoe87/upload_KQulGv-medium.png","https://s3.amazonaws.com/brewerydbapi/brewery/jAoe87/upload_KQulGv-large.png","verified","Verified","2012-01-03 02:41:33","2014-07-23 19:11:34","5606 North F 41","","Oscoda","Michigan","48750","517-739-2231","","44.4442387","-83.3453461","Y","N","N","Y","brewpub","Brewpub","US","","United States","USA","","","","","",""
"iLlMCb","Winchester Brewing Company","Good Beer for Good People","http://winchesterbrewingcompany.webs.com/","","N","https://s3.amazonaws.com/brewerydbapi/brewery/lBKttb/upload_t7FJR9-icon.png","https://s3.amazonaws.com/brewerydbapi/brewery/lBKttb/upload_t7FJR9-medium.png","https://s3.amazonaws.com/brewerydbapi/brewery/lBKttb/upload_t7FJR9-large.png","verified","Verified","2012-01-03 02:41:33","2014-11-03 12:52:53","1950 Abrams Creek Dr","","Winchester","Virginia","22601","","","39.1639505","-78.1697809","Y","N","Y","N","micro","Micro Brewery","US","","United States","USA","","","","","",""
"YhTcbr","Winchester Ciderworks","Locally owned and operated Cidery here in the Shenandoah Valley.","http://www.winchesterciderworks.com/","","N","","","","verified","Verified","2012-01-03 02:41:33","2014-10-09 15:33:30","2502 North Frederick Pike","","Winchester","Virginia","22603","540 247 9246","","39.237906","-78.200127","Y","N","N","Y","micro","Micro Brewery","US","","United States","USA","","","","","",""
"y5ueBZ","Wind River Brewing Company","Wind River Brewing Company is located at the base of the Wind River Mountains in downtown Pinedale, Wyoming. Our brewery is the spot for those who appreciate the art of handcrafted superior brews with a wide range of flavors and notes. We brew award winning beers, created in-house using only the finest ingredients and pure glacier water.    ""We are known for having legendary beer and the best food in town."" If you're looking for a quick bite to eat or want to relax and sample our entire selection of beer we welcome you to join us at Wind River Brewing Co.","http://www.windriverbrewingco.com/","1997","N","https://s3.amazonaws.com/brewerydbapi/brewery/z0gnmN/upload_fGXlLH-icon.png","https://s3.amazonaws.com/brewerydbapi/brewery/z0gnmN/upload_fGXlLH-medium.png","https://s3.amazonaws.com/brewerydbapi/brewery/z0gnmN/upload_fGXlLH-large.png","verified","Verified","2012-01-03 02:41:33","2014-07-23 19:11:34","402 W. Pine St.","","Pinedale","Wyoming","82941","307-367-2337","Sunday - Thursday: 11 a.m. - 11 p.m.  Friday & Saturday: 11 a.m. - Midnight","42.8665738","-109.8658053","Y","N","N","Y","micro","Micro Brewery","US","","United States","USA","","","","","",""
"XgybLl","Windswept Brewing Co","Beautiful beaches, a great climate, superb golf courses, fishing, nearby mountains and the world's best whisky, the Moray Coast is a great place to live. Now, Windswept Brewing Co Ltd have added award winning local ales to the list of Moray's attractions.","http://www.windsweptbrewing.co.uk","2012","N","https://s3.amazonaws.com/brewerydbapi/brewery/5QaO07/upload_PbWryh-icon.png","https://s3.amazonaws.com/brewerydbapi/brewery/5QaO07/upload_PbWryh-medium.png","https://s3.amazonaws.com/brewerydbapi/brewery/5QaO07/upload_PbWryh-large.png","verified","Verified","2012-01-03 02:41:33","2014-07-23 19:11:34","Unit B 13 Coulardbank","Industrial Estate","","Lossiemouth","IV31 6NG","01343 814310","","57.7113862","-3.3044058","Y","N","N","Y","micro","Micro Brewery","GB","2012","United Kingdom","GBR","826","","","","",""
"bRKIdZ","Main Cidery","We are the first, and only, licensed and bonded cidery in the Piedmont of the Carolinas.  We produce various types of Award Winning Hand-Crafted Hard Ciders with a commitment to sustainable agricultural practices.     As an extension of Windy Hill Orchard and Cidery, we are family owned and operated and located in York, SC.     Please be sure to visit our facebook page and our orchard website for details about upcoming events, product news, and hours and directions.","http://windyhillorchard.com/yorkcider/","2011","N","https://s3.amazonaws.com/brewerydbapi/brewery/eGtqKZ/upload_JaIVoQ-icon.png","https://s3.amazonaws.com/brewerydbapi/brewery/eGtqKZ/upload_JaIVoQ-medium.png","https://s3.amazonaws.com/brewerydbapi/brewery/eGtqKZ/upload_JaIVoQ-large.png","verified","Verified","2012-01-03 02:41:33","2014-07-23 19:11:34","1860 Black Highway","","York","South Carolina","29745","(803) 684-0690","Tuesday through Saturday: 9:00 a.m. till 5:00 p.m.  Select Sundays*: Noon till 5:00 p.m.","35.024739","-81.280858","Y","N","N","Y","micro","Micro Brewery","US","2011","United States","USA","","","","","",""
"aPdSL0","Winery Exchange","Winery Exchange was founded in 1999 and is headquartered in Novato, California, USA. The company maintains regional sales offices around the United States and international offices in the United Kingdom and Spain.    Winery Exchange is the only full-service, corporate brand, beverage alcohol company that sources beer, wine and spirits from the finest regions worldwide. The company was founded with the intent of blending extensive industry expertise with cutting-edge business practices. The result is a dynamic, fast-growing company poised to take advantage of new trends in the beverage alcohol industry.","http://www.wineryexchange.com/","1999","N","https://s3.amazonaws.com/brewerydbapi/brewery/ytIKJu/upload_3NZP95-icon.png","https://s3.amazonaws.com/brewerydbapi/brewery/ytIKJu/upload_3NZP95-medium.png","https://s3.amazonaws.com/brewerydbapi/brewery/ytIKJu/upload_3NZP95-large.png","verified","Verified","2012-01-03 02:41:33","2014-07-23 19:11:34","500 Redwood Boulevard","Suite 200","Novato","California","94947","877-946-3793","","38.0740437","-122.5428807","Y","N","N","Y","micro","Micro Brewery","US","1999","United States","USA","","","","","",""
"o3lsQF","Wingman Brewers","Inspired by Tacoma's legacy of honest hard work, Wingman Brewers strives to create a strong selection of spirited, full-flavored beers for the South Sound region.","http://wingmanbrewers.com/","2011","N","https://s3.amazonaws.com/brewerydbapi/brewery/xIWy3E/upload_42GTT4-icon.png","https://s3.amazonaws.com/brewerydbapi/brewery/xIWy3E/upload_42GTT4-medium.png","https://s3.amazonaws.com/brewerydbapi/brewery/xIWy3E/upload_42GTT4-large.png","verified","Verified","2012-01-03 02:41:33","2014-07-23 19:11:34","509 1/2 Puyallup Ave","","Tacoma","Washington","98421","(253) 256-5240","Taproom Hours:  2pm-11pm Thursday, Friday, Saturday","47.2410896","-122.4273045","Y","N","N","Y","micro","Micro Brewery","US","2011","United States","USA","","http://wingmanbrewers.us2.list-manage.com/subscribe?u=8cdc40b5134dfe3a486999b1f&id=b07c9191dd","","","",""
"CjMGUR","Wisconsin Brewing Company","he Wisconsin Brewing Company brewhouse we're building is an exciting mixture of old world, artisan craftsmanship and state-of-the art brewing technology. Built in Hudson, WI, our German-engineered Huppmann Brewhouse will be capable of producing in excess of 100,000 barrels of Wisconsin craft beer annually. The tradition and history behind Huppmann goes back more than 130 years—perfect for true craft beer.    In addition to a great brew house, we have a one-barrel Pilot Brewery on site to develop many of our beers, as well as an event center for parties and other events. The event center also has a gift shop, where you can buy Wisconsin Brewing Company apparel, gift items, and of course, beer.    Put all these pieces together next to a scenic pond with access to bike trails and plenty of beautiful landscape and you can have one heck of a brewery experience.","http://wisconsinbrewingcompany.com/","2013","N","https://s3.amazonaws.com/brewerydbapi/brewery/ho8CUc/upload_85qlJ2-icon.png","https://s3.amazonaws.com/brewerydbapi/brewery/ho8CUc/upload_85qlJ2-medium.png","https://s3.amazonaws.com/brewerydbapi/brewery/ho8CUc/upload_85qlJ2-large.png","deleted","Deleted","2012-01-03 02:41:33","2014-07-23 19:11:34","","","Wauwatosa","Wisconsin","","","","43.0494572","-88.0075875","Y","N","N","Y","micro","Micro Brewery","US","","United States","USA","","","","","",""
"iHEJZm","","","http://wisconsinbrewingcompany.com/","","","","","","verified","Verified","2012-01-03 02:41:33","2014-07-23 19:11:34","1079 American Way","","Verona","Wisconsin","53593","(608) 848-1079","Monday CLOSED  Tues-Fri 3-9pm Tours 4, 5 & 6pm  Sat 10am-9pm Tours 10am-4pm every hour  Sun 10am-5pm Tours 10am-4pm","42.9694364","-89.5120484","Y","N","N","Y","micro","Micro Brewery","US","2013","United States","USA","","","","","",""
"Pf7pos","Restaurant and Brewpub","MOOSEJAW, with their 15 barrel ""copper-clad"" brewhouse, serves 10 different styles of hand-crafted microbrews. They have the capacity to brew 500-1000 gallons of beer per day. Brewmaster Jamie Baertsch is feverishly working on seasonal flavors as well. These brews can be enjoyed at any of the three bars located within the brewpub.","http://www.dellsmoosejaw.com/","","N","https://s3.amazonaws.com/brewerydbapi/brewery/5R4Akp/upload_lSUQbW-icon.png","https://s3.amazonaws.com/brewerydbapi/brewery/5R4Akp/upload_lSUQbW-medium.png","https://s3.amazonaws.com/brewerydbapi/brewery/5R4Akp/upload_lSUQbW-large.png","verified","Verified","2012-01-03 02:41:33","2014-07-23 19:11:34","110 Wisconsin Dells Parkway South","","Wisconsin Dells","Wisconsin","53965","608-254-1122","Mon - Thu:	11:00 am - 10:30 pm  Fri - Sat:	11:00 am - 11:00 pm  Sun:	11:00 am - 10:30 pm","43.589104","-89.791861","Y","N","N","Y","brewpub","Brewpub","US","","United States","USA","","","","","",""
"efwhXc","Wiseacre Brewery and Taproom","WISEACRE is a craft brewery committed to top quality, uniquely flavorful beer that appeals to passionate & progressive people through education & good times.  The brewery name comes from a term of endearment/scolding their grandmother used on the young troublemakers.  Brothers Davin & Kellan Bartosch dreamed up WISEACRE many moons ago & have been on an extensive quest procuring top-notch experience from around the globe to deliver the crunkest brewery possible in their groovy hometown of Memphis, TN.","http://wiseacrebrew.com","2013","N","https://s3.amazonaws.com/brewerydbapi/brewery/z5vsgx/upload_q0nCdj-icon.png","https://s3.amazonaws.com/brewerydbapi/brewery/z5vsgx/upload_q0nCdj-medium.png","https://s3.amazonaws.com/brewerydbapi/brewery/z5vsgx/upload_q0nCdj-large.png","verified","Verified","2012-01-03 02:41:33","2014-07-23 19:11:34","2783 Broad Ave","","Memphis","Tennessee","38112","","Thursday-Friday 4pm-8pm  Saturday 1pm-8pm","35.1468","-89.96884","Y","N","N","Y","tasting","Tasting Room","US","2013","United States","USA","","","","","",""
"p354ds","Wit's End Brewing Company","We are an artisanal Denver brewery fueled by dreams and inspired by the limitless potential of craft beer since 2011…Join us on our journey!","http://witsendbrewing.com/","2011","N","https://s3.amazonaws.com/brewerydbapi/brewery/Wq1S61/upload_TkqW19-icon.png","https://s3.amazonaws.com/brewerydbapi/brewery/Wq1S61/upload_TkqW19-medium.png","https://s3.amazonaws.com/brewerydbapi/brewery/Wq1S61/upload_TkqW19-large.png","verified","Verified","2012-01-03 02:41:33","2014-07-23 19:11:34","2505 W 2nd Ave","Unit #13","Denver","Colorado","80219","303-359-9119","Thu:	4:00 pm - 8:00 pm  Fri - Sat:	2:00 pm - 8:00 pm  Sun:	12:00 pm - 5:00 pm","39.720248","-105.017118","Y","N","N","Y","micro","Micro Brewery","US","","United States","USA","","","","","",""
"OShITU","Witch's Hat Brewing Company","Our little family started at the Witch's Hat in South Lyon in 2007 when we said ""I do"". When life dealt us lemons we decided to make beer. Here we are - trying our hand at the Beer Lover's Dream. Give us a taste :)","http://witchshatbrewing.com/","2007","N","https://s3.amazonaws.com/brewerydbapi/brewery/3vJdrg/upload_OFi1Qx-icon.png","https://s3.amazonaws.com/brewerydbapi/brewery/3vJdrg/upload_OFi1Qx-medium.png","https://s3.amazonaws.com/brewerydbapi/brewery/3vJdrg/upload_OFi1Qx-large.png","verified","Verified","2012-01-03 02:41:33","2014-07-23 19:11:34","22235 Pontiac Trail","","South Lyon","Michigan","48178","248-486-2595","Mon-Thur 3-11  Fri-Sat 2-12  Sun 2-8","42.444618","-83.650261","Y","N","N","Y","micro","Micro Brewery","US","","United States","USA","","","","","",""
"Blig3z","Woinemer Hausbrauerei","","http://www.woinemer-brauerei.de/","","N","","","","verified","Verified","2012-01-03 02:41:33","2014-07-23 19:11:34","Friedrichstraße 23","","Weinheim a.d. Bergstraße","Baden-Württemberg","69469","","","49.553909","8.669808","N","N","N","Y","micro","Micro Brewery","DE","","Germany","DEU","276","","","","",""
"RMnsnJ","Wolaver's Fine Organic Ales","Our brewery is dedicated to brewing great tasting beers, supporting sustainable agriculture, and minimizing our impact on the environment.    100% Organic Hops and Malts","http://www.wolavers.com/","1997","Y","https://s3.amazonaws.com/brewerydbapi/brewery/Ff8SbR/upload_4OZJC6-icon.png","https://s3.amazonaws.com/brewerydbapi/brewery/Ff8SbR/upload_4OZJC6-medium.png","https://s3.amazonaws.com/brewerydbapi/brewery/Ff8SbR/upload_4OZJC6-large.png","verified","Verified","2012-01-03 02:41:33","2014-07-23 19:11:34","793 Exchange Street","","Middlebury","Vermont","05753","","","44.019665","-73.169251","Y","N","N","Y","micro","Micro Brewery","US","1997","United States","USA","","","","","",""
"3gWgwk","Wolf Creek Restaurant and Brewery","Wolf Creek Brewery was founded as a brewpub in 1997 as ""Wolf Creek Restaurant & Brewing Co."" by Rob and Laina McFerren.  Brewer, Rob, has won many awards for his varied beer styles, including ""Howlin' Hefeweizen"" (Bavarian Hef) and ""Midnight Howl"" and India Black Ale.  In 2013, they expanded brewery operations and built a production facility in the Mann-Biomedical Park in Valencia.  June 2nd, 2014 marks the date of their first bottling run.  Cheers!","http://www.wolfcreekbrewingco.com","1997","N","https://s3.amazonaws.com/brewerydbapi/brewery/99kGFS/upload_KdAFGG-icon.png","https://s3.amazonaws.com/brewerydbapi/brewery/99kGFS/upload_KdAFGG-medium.png","https://s3.amazonaws.com/brewerydbapi/brewery/99kGFS/upload_KdAFGG-large.png","verified","Verified","2012-01-03 02:41:33","2014-07-23 19:11:34","27746 McBean Pkwy","","Valencia","California","91354","661-263-9653","","34.4453226","-118.5532826","Y","N","N","Y","brewpub","Brewpub","US","","United States","USA","","","","","",""
"g0FV6B","Wolf Hills Brewing Co","WOLF HILLS BREWING CO is a craft brewery located in historic Abingdon, Virginia. The brewery takes its name from the original appellation that Daniel Boone gave to the wilderness that became Abingdon. Tradition holds that Boone and his hunting companion spent a sleepless night along a hill on the Great Road after their dogs encountered a pack of wolves, which had a den in a nearby cave. Drawing from this rich history, Wolf Hills Brewing CO melds together time honored brewing methods using only the highest quality ingredients with modern beer styles inspired by the wide array of fragrant hops from the Pacific-Northwest. Wolf Hills brews in small batches that are only distributed in the Virginia Highlands. The result is a level of fresh, savory beer that is unmatched in this region. Discover one of our many styles for yourself . . . you’ll be howling for more.","http://www.wolfhillsbrewing.com/","","N","https://s3.amazonaws.com/brewerydbapi/brewery/lTT4Ot/upload_sPQIKZ-icon.png","https://s3.amazonaws.com/brewerydbapi/brewery/lTT4Ot/upload_sPQIKZ-medium.png","https://s3.amazonaws.com/brewerydbapi/brewery/lTT4Ot/upload_sPQIKZ-large.png","verified","Verified","2012-01-03 02:41:33","2014-07-23 19:11:34","350 Park St SE","","Abingdon","Virginia","24210","276-698-6740","Check Website for Changing Growler Hours","36.7123071","-81.9656007","Y","N","N","Y","micro","Micro Brewery","US","","United States","USA","","","","","",""
"IJyJFc","Wolf Pack Brewing","","","","N","","","","verified","Verified","2012-01-03 02:41:33","2014-07-23 19:11:34","111 South Canyon Street","","West Yellowstone","Montana","59758","1-406-646-7727","","44.658457","-111.0995939","Y","N","Y","Y","micro","Micro Brewery","US","","United States","USA","","","","","",""
"udh7P3","Wolf Tongue Brewery","","","","N","","","","verified","Verified","2012-01-03 02:41:33","2014-07-23 19:11:34","35 E. First St.","","Nederland","Colorado","","","","39.9618975","-105.5097558","Y","N","Y","Y","micro","Micro Brewery","US","","United States","USA","","","","","",""
"Z0nc9c","Main Location","Wolfe Brewing Company has just opened in Pagosa Springs Colorado. Hand-crafted micro beers brewed on-site. Full menu available as well. Open 11am daily.","http://www.wolfebrewingco.com/","2014","N","https://s3.amazonaws.com/brewerydbapi/brewery/SII4fs/upload_hY88Tv-icon.png","https://s3.amazonaws.com/brewerydbapi/brewery/SII4fs/upload_hY88Tv-medium.png","https://s3.amazonaws.com/brewerydbapi/brewery/SII4fs/upload_hY88Tv-large.png","verified","Verified","2012-01-03 02:41:33","2014-07-23 19:11:34","2045 Eagle Drive","","Pagosa Springs","Colorado","81147","(970) 731-9653","Mon - Sun: 11:00 am - 2:00 am","37.270504","-107.044128","Y","N","N","Y","brewpub","Brewpub","US","2014","United States","USA","","","","","",""
"WxPvYU","Wolnzacher Bürgerbraü AG","","","","N","","","","verified","Verified","2012-01-03 02:41:33","2014-07-23 19:11:34","Am Brunnen 2","","Wolnzach","Bayern","","49-(0)8442-/-955514","","48.6088748","11.6186971","Y","N","N","Y","micro","Micro Brewery","DE","","Germany","DEU","276","","","","",""
