"id","name","description","website","established","isOrganic","images__icon","images__medium","images__large","status","statusDisplay","createDate","updateDate","streetAddress","extendedAddress","locality","region","postalCode","phone","hoursOfOperation","latitude","longitude","isPrimary","inPlanning","isClosed","openToPublic","locationType","locationTypeDisplay","countryIsoCode","yearOpened","displayName","isoThree","numberCode","mailingListUrl","yearClosed","currentPage","numberOfPages","totalResults"
"9H8jhv","Wolverine State Brewing Company","We are the proud brewers of Michigan's Most Drinkable Beers. We are the only microbrewery in Michigan that specializes in making lagers for everyone. What does this mean? It means that from light to dark, every beer we brew is designed to be a beer you can love.","http://www.wolverinebeer.com/","2010","N","https://s3.amazonaws.com/brewerydbapi/brewery/xoGGQz/upload_IXmwtv-icon.png","https://s3.amazonaws.com/brewerydbapi/brewery/xoGGQz/upload_IXmwtv-medium.png","https://s3.amazonaws.com/brewerydbapi/brewery/xoGGQz/upload_IXmwtv-large.png","verified","Verified","2012-01-03 02:41:33","2014-07-23 19:11:34","2019 West Stadium Boulevard","","Ann Arbor","Michigan","48103","734-369-2990","","42.2702084","-83.7737021","Y","N","N","Y","brewpub","Brewpub","US","2010","United States","USA","","","","","",""
"TjVYwC","Wonderland Brewing Company","Wonderland Brewing Company is a new small batch brewery in Broomfield, Colorado, and our goal is to turn every frown upside down. Big dreams, a big property, and carefully crafted beers are our not-so-secret ingredients to do so. With 9,000-square-feet of space, 94 parking spots, and over an acre of outdoor fun, Wonderland Brewing Company offers a unique craft beer experience to beer-buffs of all sorts.    How can you get a unique craft beer experience at our brewery, you wonder? Hold a ping pong match on one of our six tournament-style ping pong tables that adorn our tasting room, burn those hard earned beer calories al fresco on our basketball courts, or simply take a seat in one of the largest tasting rooms around and enjoy a quality, hand-crafted brew. Thanks to our shocking space that's ideal for corporate outings, private parties, farmers markets, classic car shows, yoga classes, and more, Wonderland Brewing Company is an oasis for the community and beyond.    Enough bragging about our property, though. Wanna know why we chose to dive into the brewing industry?    Our passion for people, happiness, and the magic behind making beer inspires our team to bring the community together to celebrate life and cherish the ritual of beer. We truly treasure craft beer's gift of rallying friends and family, and we are excited for the opportunity to bring joy to beer-fanatics. Our head brewer values the art and science of brewing beer and has a philosophy entrenched in care for his creations, which will be discovered during every sip of our quality brews.    When you visit Wonderland, you'll find a creative crew that is committed to making you smile.    Please know that standards are set high for Wonderland Brewing Company in all aspects of our brewery.","http://wonderlandbrewing.com/","","N","https://s3.amazonaws.com/brewerydbapi/brewery/aKccxT/upload_KNpRbF-icon.png","https://s3.amazonaws.com/brewerydbapi/brewery/aKccxT/upload_KNpRbF-medium.png","https://s3.amazonaws.com/brewerydbapi/brewery/aKccxT/upload_KNpRbF-large.png","verified","Verified","2012-01-03 02:41:33","2014-07-25 14:11:20","5450 W 120th Ave","","Broomfield","Colorado","80020","(303) 953-0400","Mon:  3:00pm - 10:00pm Tue:  3:00pm - 10:00pm Wed:  3:00pm - 10:00pm Thu:  3:00pm - 10:00pm Fri:  12:00pm - 11:00pm Sat:  11:00am - 11:00pm Sun:  11:00am - 9:00pm  ","39.9133224","-105.0558566","Y","N","N","Y","micro","Micro Brewery","US","","United States","USA","","","","","",""
"TlBAjN","Wood Boat Brewing Company","","http://www.woodboatbrewery.com/","","N","","","","verified","Verified","2012-01-03 02:41:33","2014-07-23 19:11:34","702 East Lake View Road","Suite C","Syracuse","Indiana","46567","855.966.3969","","41.41006","-85.738512","Y","N","N","Y","micro","Micro Brewery","US","","United States","USA","","","","","",""
"larXrM","Woodcock Brothers Brewery","","http://woodcockbrothersbrewery.com/","2011","N","https://s3.amazonaws.com/brewerydbapi/brewery/NnBsYK/upload_1rxQre-icon.png","https://s3.amazonaws.com/brewerydbapi/brewery/NnBsYK/upload_1rxQre-medium.png","https://s3.amazonaws.com/brewerydbapi/brewery/NnBsYK/upload_1rxQre-large.png","verified","Verified","2012-01-03 02:41:33","2014-07-23 19:11:34","638 Lake Street","","Wilson","New York","14172","716-957-6625","","43.2984099","-78.825192","Y","N","N","Y","micro","Micro Brewery","US","","United States","USA","","","","","",""
"NuaM0n","Wooden Legs Brewing Company","The Wooden Legs Brewing Company name is tongue in cheek homage to Judge Wilmot Wood Brookings. Judge Brookings is a significant figure in history of South Dakota. The county and city were named after him although he only visited the city twice.    In February 1858, Brookings rode a horse from Sioux Falls to the Yankton area during a blizzard. His horse slipped and fell into Split Rock Creek in the freezing weather. Brookings made it safely to Yankton, but his wet legs had suffered such severe frostbite they both needed to be amputated. He spent the rest of his life using a pair of squeaky, wooden legs.","http://www.woodenlegsbrewing.com/","","N","","","","verified","Verified","2012-01-03 02:41:33","2014-07-23 19:11:34","3011 5th St","","Brookings","South Dakota","57006","605-549-5624","","44.31022","-96.779609","Y","N","N","Y","micro","Micro Brewery","US","","United States","USA","","","","","",""
"CljuZN","Wooden Robot Brewery","Wooden Robot is a new urban farmhouse craft brewery that will be located in Charlotte, NC!","","","N","https://s3.amazonaws.com/brewerydbapi/brewery/zxMohP/upload_yTfDU0-icon.png","https://s3.amazonaws.com/brewerydbapi/brewery/zxMohP/upload_yTfDU0-medium.png","https://s3.amazonaws.com/brewerydbapi/brewery/zxMohP/upload_yTfDU0-large.png","verified","Verified","2012-01-03 02:41:33","2014-08-25 01:13:32","","","Charlotte","North Carolina","","","","35.2270869","-80.8431267","Y","Y","N","Y","micro","Micro Brewery","US","","United States","USA","","","","","",""
"0EJAAE","Wooden Shoe Brewing Company","","http://woodenshoebrews.com/","2010","N","","","","verified","Verified","2012-01-03 02:41:33","2014-07-23 19:11:34","69 South Garfield","","Minster","Ohio","45865","419-305-0636","","40.391478","-84.3753119","Y","N","N","Y","micro","Micro Brewery","US","2010","United States","USA","","","","","",""
"cY1yJf","Woodforde's Norfolk Ales","","","","N","","","","verified","Verified","2012-01-03 02:41:33","2014-07-23 19:11:34","Woodbastwick","","Norwich","Norfolk","","44-(01603)-720353","","52.684341","1.44791","Y","N","N","Y","micro","Micro Brewery","GB","","United Kingdom","GBR","826","","","","",""
"ErkmT6","Woodfour Brewing Company","A contemporary artisan brewery focused on a unique beer experience. Located in the heart of Sonoma County. Opening Spring 2013...","http://w4brewing.com/","","N","https://s3.amazonaws.com/brewerydbapi/brewery/cQdUrC/upload_JXMgz6-icon.png","https://s3.amazonaws.com/brewerydbapi/brewery/cQdUrC/upload_JXMgz6-medium.png","https://s3.amazonaws.com/brewerydbapi/brewery/cQdUrC/upload_JXMgz6-large.png","verified","Verified","2012-01-03 02:41:33","2014-07-23 19:11:34","6780 Depot Street","","Sebastopol","California","95472","(707) 823-3144","","38.4030897","-122.821333","Y","N","N","Y","micro","Micro Brewery","US","","United States","USA","","","","","",""
"x4vqAl","Woodland Empire Ale Craft","Imaginative brew creations concocted by husband and wife team Rob and Keely Landerman, Dusty Schmidt, and Tom Dolan.  Handcrafted. Imaginative. Idahoan.","http://woodlandempire.com/","2014","N","https://s3.amazonaws.com/brewerydbapi/brewery/0j4t2Z/upload_Kqra3P-icon.png","https://s3.amazonaws.com/brewerydbapi/brewery/0j4t2Z/upload_Kqra3P-medium.png","https://s3.amazonaws.com/brewerydbapi/brewery/0j4t2Z/upload_Kqra3P-large.png","verified","Verified","2012-01-03 02:41:33","2014-07-23 19:11:34","1114 W Front St","","Boise","Idaho","83704","","Tasting Room hours:   Tues- Thurs: 3 pm- 10 pm  Fri: 3 pm-11 pm  Sat: 12 noon-11 pm  Sun: 12 noon-8 pm","43.616471","-116.208926","Y","N","N","Y","micro","Micro Brewery","US","2012","United States","USA","","","","","",""
"rBTacX","Woodman Brewery","Custom Brewing Services and Brewpub at the Whistle Stop","http://www.woodmanwi.com/","","N","https://s3.amazonaws.com/brewerydbapi/brewery/yiYdH5/upload_WHjzOA-icon.png","https://s3.amazonaws.com/brewerydbapi/brewery/yiYdH5/upload_WHjzOA-medium.png","https://s3.amazonaws.com/brewerydbapi/brewery/yiYdH5/upload_WHjzOA-large.png","verified","Verified","2012-01-03 02:41:33","2014-07-23 19:11:34","401 Main St","","Woodman","Wisconsin","53827","608-533-2200","Mon - Sun: 9:00 am - 10:00 pm","43.0897818","-90.8022084","Y","N","N","Y","micro","Micro Brewery","US","","United States","USA","","","","","",""
"pfj3jO","Downtown Grill & Brewery","The Downtown Grill & Brewery is a nice brewpub downtown with patio seating on Gay Street as well as a back porch. The atmosphere is lodge-like with rich wood and copper brewing equipment. There is also a private room you can rent upstairs.","http://woodruffbrewing.com/","2006","N","https://s3.amazonaws.com/brewerydbapi/brewery/IgdWNj/upload_HoAg3q-icon.png","https://s3.amazonaws.com/brewerydbapi/brewery/IgdWNj/upload_HoAg3q-medium.png","https://s3.amazonaws.com/brewerydbapi/brewery/IgdWNj/upload_HoAg3q-large.png","verified","Verified","2012-01-03 02:41:33","2014-07-23 19:11:34","424 South Gay Street","","Knoxville","Tennessee","37902","865-603-8750","","35.9656347","-83.9183508","Y","N","N","N","brewpub","Brewpub","US","2006","United States","USA","","","","","",""
"lwZBU3","Woods Polk Station","Adventurous beer for curious drinkers. Brewed fresh in San Francisco and Oakland, CA.","http://www.woodsbeer.com/","","Y","https://s3.amazonaws.com/brewerydbapi/brewery/iB1f9m/upload_BdJGge-icon.png","https://s3.amazonaws.com/brewerydbapi/brewery/iB1f9m/upload_BdJGge-medium.png","https://s3.amazonaws.com/brewerydbapi/brewery/iB1f9m/upload_BdJGge-large.png","verified","Verified","2012-01-03 02:41:33","2014-09-19 18:04:44","2255 Polk St.","","San Francisco","CA","94109","","","37.7974534","-122.4221267","N","N","N","Y","tasting","Tasting Room","US","","United States","USA","","","","","",""
"OGHzdU","Cervecería","","","","","","","","verified","Verified","2012-01-03 02:41:33","2014-09-19 18:07:23","3801 18th St.","","San Francisco","CA","94114","","","37.7611033","-122.4284314","N","N","N","Y","brewpub","Brewpub","US","","United States","USA","","","","","",""
"0a0nmv","Woods Bar and Brewery","","","","","","","","verified","Verified","2012-01-03 02:41:33","2014-09-19 18:05:53","1701 Telegraph","","Oakland","CA","94612","","","37.8070162","-122.2705888","Y","N","N","Y","brewpub","Brewpub","US","","United States","USA","","","","","",""
"TVCOly","Woodstock Inn Station & Brewery","The Woodstock Inn opened in 1982.    The Woodstock Inn Brewery began brewing beer in 1995 on a 7 barrel system. We started as a Brew Pub with 8 different beers. As demand for our beers grew we added a 30 barrel production facility in 2012. We have two breweries on our property. The seven barrel brewery brews for our restaurant and does limited releases. The 30 barrel does all of our production and bottling. We do Brewery Tours every day at noon, seven days a week. There is a $5.00 charge, a pint glass a tasting is included. We also have a cask ale always on in the Brew Pub.       The Brewery is open for breakfast, lunch and dinner, 7 days a week. We also have 33 well appointed guest rooms, we also have a function room for 165 for weddings and gatherings.  Please stop by for a visit.","http://www.woodstockinnnh.com/","1995","N","https://s3.amazonaws.com/brewerydbapi/brewery/uEeGC0/upload_cZJJV4-icon.png","https://s3.amazonaws.com/brewerydbapi/brewery/uEeGC0/upload_cZJJV4-medium.png","https://s3.amazonaws.com/brewerydbapi/brewery/uEeGC0/upload_cZJJV4-large.png","verified","Verified","2012-01-03 02:41:33","2014-07-23 19:11:34","135 Main Street North","","Woodstock","New Hampshire","03262","800-321-3985","Open 11:30am-10pm Daily   Please call ahead for offseason hours","44.0323926","-71.6868168","Y","N","N","Y","brewpub","Brewpub","US","1995","United States","USA","","","","","",""
"5ovCvP","Woodward Avenue Brewers","Woodward Avenue Brewers, or “WAB”, as we're affectionately called, is much more than a restaurant or bar. Established in 1997, The WAB has become a landmark along Woodward Avenue in Ferndale and has welcomed visitors – those in the neighborhood and those far and wide – for more than 16 years. Pioneers of the craft brew scene, WAB is the go-to gathering place for patrons to enjoy handcrafted brews, great food, friendly atmosphere and the action on historic Woodward Avenue.","http://www.thewabsite.com/","1997","N","https://s3.amazonaws.com/brewerydbapi/brewery/EkMJ0d/upload_5xwwFM-icon.png","https://s3.amazonaws.com/brewerydbapi/brewery/EkMJ0d/upload_5xwwFM-medium.png","https://s3.amazonaws.com/brewerydbapi/brewery/EkMJ0d/upload_5xwwFM-large.png","verified","Verified","2012-01-03 02:41:33","2014-07-23 19:11:34","22646 Woodward Ave","","Ferndale","Michigan","48220","248-546-3696","","42.4591932","-83.133351","Y","N","N","Y","brewpub","Brewpub","US","","United States","USA","","","","","",""
"i8e14q","Woody's Nanobrewery","","http://www.woodysnanobrewery.com/","","N","","","","verified","Verified","2012-01-03 02:41:33","2014-07-23 19:11:34","22820 Carriage Dr","","Reno","Nevada","89521","","","39.350926","-119.77497","Y","N","N","Y","micro","Micro Brewery","US","","United States","USA","","","","","",""
"0hPHFO","Wop's Hops Brewing Company","Wop's Hops Brewing Co. is Sanford, Florida's first microbrewery. Come sample our fine Ales in our tasting room and beer garden. Dog friendly.","","","N","https://s3.amazonaws.com/brewerydbapi/brewery/ykwHM1/upload_rl3qKD-icon.png","https://s3.amazonaws.com/brewerydbapi/brewery/ykwHM1/upload_rl3qKD-medium.png","https://s3.amazonaws.com/brewerydbapi/brewery/ykwHM1/upload_rl3qKD-large.png","verified","Verified","2012-01-03 02:41:33","2014-10-28 20:11:21","419 South Sanford Ave","","Sanford","FL","32771","407-8787819","Thurs,Fri and Sat 4pm Till Closing","28.8083298","-81.2648608","N","N","N","Y","micro","Micro Brewery","US","","United States","USA","","","","","",""
"kDhJT9","Working Man Brewing Company","Working Man Brewing is Livermore’s newest brewery, located at 5542 Brisa Street, just off of Vasco Road.  Getting the brewery up and running has been a labor of love for the owners, taking the better part of 18 months to turn the space into a full production brewery.  We are excited to finally bring our love of beer and commitment to quality to Livermore, the Tri-Valley, and beyond.    Our story is one of two independent breweries, Mt. Diablo Brewing and Working Man Brewing Company, coming together to work on one common goal.  Both companies were founded by award-winning home brewers who have a passion to bring high quality, well crafted beer that is fresh and local.  A chance meeting brought these working men together; a shared vision now combines forces under one name, Working Man Brewing Company.    The company’s brewers have each have spent years working to perfect great beer recipes.  Beer geeks at heart, both will tinker and tweak the ingredients until the product is just right.  The main goal always being to make a beer they could be proud to share and proud to drink. We never let a beer go out the door that we don’t believe in.","http://www.workingmanbrewing.com/","2013","N","https://s3.amazonaws.com/brewerydbapi/brewery/H8jawh/upload_zvrjZf-icon.png","https://s3.amazonaws.com/brewerydbapi/brewery/H8jawh/upload_zvrjZf-medium.png","https://s3.amazonaws.com/brewerydbapi/brewery/H8jawh/upload_zvrjZf-large.png","verified","Verified","2012-01-03 02:41:33","2014-07-23 19:11:34","5542 Brisa Street","Suite F","Livermore","California","94550","(925) 269-9622","Friday 4-7PM  Saturday 12-6PM  Sunday 12-4PM","37.697526","-121.725189","Y","N","N","Y","micro","Micro Brewery","US","2013","United States","USA","","http://beer.wickedcode.com/?page_id=641","","","",""
"KSMpEH","Workshop Brewpub","","","","N","","","","verified","Verified","2012-01-03 02:41:33","2014-07-23 19:11:34","2524 Southeast Clinton Street","","Portland","Oregon","97202","503-954-1606","","45.5033671","-122.6398102","Y","N","N","Y","brewpub","Brewpub","US","","United States","USA","","","","","",""
"wm5dNi","Wormtown Brewery","Worcester's only brewery.  Winner of numerous awards including the 2014 US Open Grand National Champion.","http://www.wormtownbrewery.com/","2010","N","https://s3.amazonaws.com/brewerydbapi/brewery/bKPbvo/upload_Nepk2I-icon.png","https://s3.amazonaws.com/brewerydbapi/brewery/bKPbvo/upload_Nepk2I-medium.png","https://s3.amazonaws.com/brewerydbapi/brewery/bKPbvo/upload_Nepk2I-large.png","verified","Verified","2012-01-03 02:41:33","2014-09-26 14:01:11","455 Park Ave","","Worcester","Massachusetts","01610","774-239-1555","Mon - Sun: 12:00 pm - 10:00 pm","42.254511","-71.8259346","Y","N","N","Y","micro","Micro Brewery","US","1978","United States","USA","","","","","",""
"Z5oRX9","Worth Brewing Company","Backed by the support of countless friends and neighbors, Worth Brewing Company opened on March 17, 2007. Its owners, the husband-and-wife team of Peter Ausenhus and Margaret Bishop, have lived near Northwood since their purchase of a nearby farmhouse and acreage in 1998. Nebraska natives, Peter and Margaret lived and worked in Minneapolis for many years before moving to Worth County, where Peter’s grandparents had lived and farmed and where Peter had spent much time as a boy.     Having already established Margaret’s engineering business in downtown Northwood, the couple turned next to Peter’s passion – brewing great beer. For 24 years, Peter has brewed award-winning beer, winning contests, teaching others and perfecting classic recipes along the way. He’s a BJCP National Beer Judge, has brewed professionally with Summit Brewing Company of St. Paul, Minn., and worked on staff at one of the country’s most popular brewing supply shops.    Worth Brewing Company is Peter and Margaret’s way of helping to reintroduce a great tradition – the locally owned brewery serving hand-crafted, high-quality, distinctive beers for the enjoyment of locals and lucky visitors. The nation’s small and mid-sized towns were once dotted with such breweries. Today, Worth Brewing – perhaps one of the world’s smallest craft brewers – brings a bit of those days back to delight the growing number of those who appreciate fine, locally brewed beers.","http://www.worthbrewing.com/","2007","N","https://s3.amazonaws.com/brewerydbapi/brewery/5hWjSw/upload_Khe2DC-icon.png","https://s3.amazonaws.com/brewerydbapi/brewery/5hWjSw/upload_Khe2DC-medium.png","https://s3.amazonaws.com/brewerydbapi/brewery/5hWjSw/upload_Khe2DC-large.png","verified","Verified","2012-01-03 02:41:33","2014-07-23 19:11:34","826 Central Ave","","Northwood","Iowa","50459","641-324-4991","Tap Room Hours:   Wed: 5 to 9 p.m.  Fri: 5 to 11 p.m.  Sat: noon to 11 p.m.","43.444055","-93.220486","Y","N","N","Y","micro","Micro Brewery","US","2007","United States","USA","","","","","",""
"RC4BkU","Worthy Brewing","Worthy Brewing is going big.  We hit the ground running as a production brewery with the capacity to brew 60,000 barrels from the get go.  With about 22,000 square feet of  floor space and an average ceiling height of 35 feet, we’ll have plenty of room to grow in.","http://www.worthybrewing.com/","2011","N","https://s3.amazonaws.com/brewerydbapi/brewery/LnNf4b/upload_f7xPLI-icon.png","https://s3.amazonaws.com/brewerydbapi/brewery/LnNf4b/upload_f7xPLI-medium.png","https://s3.amazonaws.com/brewerydbapi/brewery/LnNf4b/upload_f7xPLI-large.png","verified","Verified","2012-01-03 02:41:33","2014-07-23 19:11:34","495 NE Bellevue Ave.","","Bend","Oregon","97701","(541) 639-4776","Mon - Thu: 11:00 am - 10:00 pm  Fri - Sat: 11:00 am - 11:00 pm  Sun: 11:00 am - 10:00 pm","44.0548956","-121.2613389","Y","N","N","Y","micro","Micro Brewery","US","2011","United States","USA","","","","","",""
"xd2mdS","Wrecker Brewing","","","","N","https://s3.amazonaws.com/brewerydbapi/brewery/fE3e0J/upload_U4jxQS-icon.png","https://s3.amazonaws.com/brewerydbapi/brewery/fE3e0J/upload_U4jxQS-medium.png","https://s3.amazonaws.com/brewerydbapi/brewery/fE3e0J/upload_U4jxQS-large.png","verified","Verified","2012-01-03 02:41:33","2014-09-05 12:26:32","","","New Albany","Indiana","","","","38.2856247","-85.8241312","Y","Y","N","Y","micro","Micro Brewery","US","","United States","USA","","","","","",""
"eGtqKZ","Wrecking Bar Brewpub","The most exciting new brewpub in Atlanta! A cornerstone of both Little Five Points and Inman Park at the corner of Moreland and Austin Ave. Brewpub on lower level facing Austin.","http://www.wreckingbarbrewpub.com/","2011","N","https://s3.amazonaws.com/brewerydbapi/brewery/GmYAZI/upload_jgE51A-icon.png","https://s3.amazonaws.com/brewerydbapi/brewery/GmYAZI/upload_jgE51A-medium.png","https://s3.amazonaws.com/brewerydbapi/brewery/GmYAZI/upload_jgE51A-large.png","verified","Verified","2012-01-03 02:41:33","2014-07-23 19:11:34","292 Moreland Avenue NE","","Atlanta","Georgia","30307","(404) 221-2600","Mon - Thu:	4:00 pm - 11:00 pm  Fri:	4:00 pm - 12:00 am  Sat:	12:00 pm - 12:00 am  Sun:	12:00 pm - 11:00 pm","33.763276","-84.349233","Y","N","N","Y","brewpub","Brewpub","US","2011","United States","USA","","","","","",""
"3LX5bo","Wuppertaler Brauhaus","","http://www.wuppertalerbrauhaus.de/","1997","N","https://s3.amazonaws.com/brewerydbapi/brewery/O4qGIu/upload_hnoeh5-icon.png","https://s3.amazonaws.com/brewerydbapi/brewery/O4qGIu/upload_hnoeh5-medium.png","https://s3.amazonaws.com/brewerydbapi/brewery/O4qGIu/upload_hnoeh5-large.png","verified","Verified","2012-01-03 02:41:33","2014-07-23 19:11:34","Kleine Flurstraße 5","","Barmen","Nordrhein-Westfalen","D-42275","","","51.271556","7.19657","N","N","N","Y","micro","Micro Brewery","DE","","Germany","DEU","276","","","","",""
"BPXFga","Würzburger Hofbräu AG","","","","N","","","","verified","Verified","2012-01-03 02:41:33","2014-07-23 19:11:34","Hchberger Strae 28","","Wrzburg","Bayern","","49-(0)931-/-4109-0","","49.7918864","9.9150578","Y","N","N","Y","micro","Micro Brewery","DE","","Germany","DEU","276","","","","",""
"njG3q1","Wychwood Brewery","","","","N","","","","verified","Verified","2012-01-03 02:41:33","2014-07-23 19:11:34","The Eagle Maltings","","Witney","Oxford","","44-(01993)-890800","","33.613075","-85.835699","Y","N","N","Y","micro","Micro Brewery","GB","","United Kingdom","GBR","826","","","","",""
"2Mhg8t","Wyder's Cider Company","Wyder's® Cider was formulated in 1987 by cider master Ian Wyder who learned his craft in England at one of the UK's premier ciderys.    Wyder's Cider was first sold in Vancouver, Canada and was later introduced into the US market in Washington and Oregon. Northern California's Bay Area got a taste in 1993 and Wyder's Cider is now widely available throughout the Western US.","http://www.wyders.com/","1987","N","https://s3.amazonaws.com/brewerydbapi/brewery/22BrYf/upload_bYKHGR-icon.png","https://s3.amazonaws.com/brewerydbapi/brewery/22BrYf/upload_bYKHGR-medium.png","https://s3.amazonaws.com/brewerydbapi/brewery/22BrYf/upload_bYKHGR-large.png","verified","Verified","2012-01-03 02:41:33","2014-07-23 19:11:34","153 Pond Lane","","Middlebury","Vermont","05753","802-388-0700","","44.034351","-73.173546","Y","N","N","Y","micro","Micro Brewery","US","1987","United States","USA","","","","","",""
"egQUIK","Wye Valley Brewery","","","","N","","","","verified","Verified","2012-01-03 02:41:33","2014-07-23 19:11:34","Stoke Lacy HR7 4HG","","Stoke Lacy","Hereford and Worcester","","44-(01885)-490505","","52.146875","-2.550715","Y","N","N","Y","micro","Micro Brewery","GB","","United Kingdom","GBR","826","","","","",""
"tZqsYb","Wylam Brewery","A well established successful brewery in Northumberland, UK.","http://www.wylambrewery.co.uk/","2000","N","","","","verified","Verified","2012-01-03 02:41:33","2014-07-23 19:11:34","South Houghton Farm,","Heddon on the Wall","Northumberland","","NE15 0EZ","+44 1661 853377","Monday	9:00 am – 4:00 pm  Tuesday	9:00 am – 4:00 pm  Wednesday	9:00 am – 4:00 pm  Thursday	9:00 am – 4:00 pm  Friday	9:00 am – 3:00 pm  Saturday	Closed  Sunday	Closed","54.9949878","-1.805779","Y","N","N","Y","micro","Micro Brewery","GB","2000","United Kingdom","GBR","826","","","","",""
