"id","name","description","website","established","isOrganic","images__icon","images__medium","images__large","status","statusDisplay","createDate","updateDate","streetAddress","extendedAddress","locality","region","postalCode","phone","hoursOfOperation","latitude","longitude","isPrimary","inPlanning","isClosed","openToPublic","locationType","locationTypeDisplay","countryIsoCode","yearOpened","displayName","isoThree","numberCode","mailingListUrl","yearClosed","currentPage","numberOfPages","totalResults"
"H09IRl","Wynkoop Brewing Company","Colorado’s first brewpub, Wynkoop Brewing Company was founded in 1988 by a group of young entrepreneurs and urban pioneers led by current Denver Governor John Hickenlooper.    Our brewpub’s hallmarks -- highly acclaimed small-batch beers, high quality food & service, the city’s best pool hall and our glorious 1888 building -- helped make us a major catalyst for the revival of Lower Downtown Denver.    Today Wynkoop Brewing Company is a beer-blessed Denver institution, a must-visit Colorado landmark and one of the nation’s most revered craft breweries.    We’re also one of the city’s best places for private and corporate events. We’ve hosted everything from Democratic National Convention parties to beer festivals, weddings and company conferences. (All with great beer and food.)    Today we’re expanding our downtown brewing efforts to deliver more of our ambitious, artisan-style craft beer to Denver’s best beer outlets. Look for cans of our beer in local stores and kegs of all of our beers at the area’s top bars and restaurants.","http://www.wynkoop.com/","1988","N","https://s3.amazonaws.com/brewerydbapi/brewery/GfdTrX/upload_oxC8S0-icon.png","https://s3.amazonaws.com/brewerydbapi/brewery/GfdTrX/upload_oxC8S0-medium.png","https://s3.amazonaws.com/brewerydbapi/brewery/GfdTrX/upload_oxC8S0-large.png","verified","Verified","2012-01-03 02:41:33","2014-07-23 19:11:34","1634 18th Street","","Denver","Colorado","80202","303-297-2700","Mon - Sun: 11:00 am - 2:00 am","39.753509","-104.998505","Y","N","N","Y","micro","Micro Brewery","US","1988","United States","USA","","","","","",""
"tJs6bC","Wynwood Brewing Company","Wynwood Brewing Company is Miami’s first craft production brewery in the heart of Wynwood Art District, featuring a tap room. We are family owned and operated with the simple objective of bringing fresh, delicious, and creative beers to thirsty South Floridians and tourists alike. We operate a 15-barrel brewhouse and distribute our blond ale, IPA, Porter, barrel aged Strong Ales and seasonal offerings.","http://www.wynwoodbrewing.com/","2011","N","https://s3.amazonaws.com/brewerydbapi/brewery/i1FXcN/upload_aklOyy-icon.png","https://s3.amazonaws.com/brewerydbapi/brewery/i1FXcN/upload_aklOyy-medium.png","https://s3.amazonaws.com/brewerydbapi/brewery/i1FXcN/upload_aklOyy-large.png","deleted","Deleted","2012-01-03 02:41:33","2014-10-18 07:59:55","3232 Coral Way","#1708","Miami","Florida","33145","305-434-0323","","25.7500026","-80.2472165","N","N","N","Y","micro","Micro Brewery","US","","United States","USA","","","","","",""
"PhVTto","Wynwood Brewing Company","","http://wynwoodbrewing.com/","","","","","","verified","Verified","2012-01-03 02:41:33","2014-10-18 07:59:25","565 NW 24 Street","","Miami","Florida","33127","(305) 640-5043","Tue:  2:00pm - 11:00pm Wed:  2:00pm - 11:00pm Thu:  2:00pm - 11:00pm Fri:  2:00pm - 12:00am Sat:  12:00pm - 12:00am Sun:  12:00pm - 10:00pm  ","25.800161","-80.20435","Y","N","N","Y","micro","Micro Brewery","US","2013","United States","USA","","","","","",""
"EiCuSk","WYOld West Brewing Company","WYOld West Brewing Company features goods from Wyoming's sun-kissed harvest. Located in the heart of downtown Powell, Wyoming.","http://wyoldwest.com/","","N","https://s3.amazonaws.com/brewerydbapi/brewery/hfm9Wj/upload_HCrzk0-icon.png","https://s3.amazonaws.com/brewerydbapi/brewery/hfm9Wj/upload_HCrzk0-medium.png","https://s3.amazonaws.com/brewerydbapi/brewery/hfm9Wj/upload_HCrzk0-large.png","verified","Verified","2012-01-03 02:41:33","2014-09-24 19:16:07","221 N Bent St","","Powell","Wyoming","82435","","","44.7546391","-108.7569372","Y","Y","Y","N","brewpub","Brewpub","US","","United States","USA","","","","","",""
"Vdaukd","Wyoming State Brewing Company","The World Famous Wonder Bar is home to the Wyoming State Brewing Company, Casper’s only premium microbrewery.    Brewmaster Ty Martinez handcrafts brews from the finest ingredients and leaves the beer unfiltered, resulting in nothing but pure, bold flavors. Our taps rotate constantly, so you always have something new to try.    Over the past few years, we have grown, but we’re still a small-town business with a few local employees who are as passionate about their beer as they are about the Wyoming lifestyle. They work hard  and are dedicated to the unofficial drink of our great state.    Craving an amazing small-batch beer? We make over 15 styles of beer—from Big Horn Black Ale with toasted malt to Oil City IPA, and Grandma Betty’s Pale Ale made with apricots—and we hope you enjoy them as much as we do.    Take home a fresh Wyoming State Brewing Company growler from our huge selection. Our brew flavors rotate regularly, so be sure to check out our Facebook page or website for the daily picks. And don’t forget your punch card. Fill 9 and get the 10th free.","http://www.thewonderbar.com/wyoming-state-brewing-company/","","N","https://s3.amazonaws.com/brewerydbapi/brewery/YyPy4g/upload_tE0KDV-icon.png","https://s3.amazonaws.com/brewerydbapi/brewery/YyPy4g/upload_tE0KDV-medium.png","https://s3.amazonaws.com/brewerydbapi/brewery/YyPy4g/upload_tE0KDV-large.png","verified","Verified","2012-01-03 02:41:33","2014-09-18 17:18:15","256 South Center","","Casper","Wyoming","82601","307-234-4110","","42.847645","-106.325566","Y","N","N","Y","micro","Micro Brewery","US","","United States","USA","","","","","",""
"7xJiu4","Wyoming Territory Brewing Company","","http://www.buffalobillcodybeer.com/","","N","","","","verified","Verified","2012-01-03 02:41:33","2014-07-23 19:11:34","","","Cody","Wyoming","","","","44.526084","-109.057264","Y","N","N","N","micro","Micro Brewery","US","","United States","USA","","","","","",""
"cAAw95","Main Office","","http://www.xbeeriment.dk/","2008","N","https://s3.amazonaws.com/brewerydbapi/brewery/Qywqcj/upload_vxDAAV-icon.png","https://s3.amazonaws.com/brewerydbapi/brewery/Qywqcj/upload_vxDAAV-medium.png","https://s3.amazonaws.com/brewerydbapi/brewery/Qywqcj/upload_vxDAAV-large.png","verified","Verified","2012-01-03 02:41:33","2014-07-23 19:11:34","Højmosevej 42","","2400 København NV","København","","+45 23 84 73 62","","38.502045","-117.022583","Y","N","N","N","office","Office","DK","2008","Denmark","DNK","208","","","","",""
"BsdMlk","XII Tribes Brewing Company","Dedicated to quality craft beer, & creating a culture of integrity for the everyday go-getter. Experience the weekend everyday. High Point, NC. 2015.","http://twelvetribesbrewing.com/","","N","https://s3.amazonaws.com/brewerydbapi/brewery/dD3bU7/upload_6Yc9Bv-icon.png","https://s3.amazonaws.com/brewerydbapi/brewery/dD3bU7/upload_6Yc9Bv-medium.png","https://s3.amazonaws.com/brewerydbapi/brewery/dD3bU7/upload_6Yc9Bv-large.png","verified","Verified","2012-01-03 02:41:33","2014-10-29 12:19:12","","","High Point","North Carolina","27260","","","35.9623181","-79.9752212","N","Y","N","Y","micro","Micro Brewery","US","","United States","USA","","","","","",""
"kH2X3V","Yak & Yeti Brewpub","The Yak and Yeti Brewpub is located in Olde Town Arvada and resides in an 1864 haunted Victorian brick mansion. Our 7 barrel brewhouse can be seen from the lobby near the bar.     All our beers are handcrafted by our brewmaster, Adam Draeger. Seasonals beers are released monthly and sometimes weekly. Stop by for pint of craft beer or take home a growler today.","http://www.theyakandyeti.com/","2008","N","https://s3.amazonaws.com/brewerydbapi/brewery/De8Q5F/upload_BrArvM-icon.png","https://s3.amazonaws.com/brewerydbapi/brewery/De8Q5F/upload_BrArvM-medium.png","https://s3.amazonaws.com/brewerydbapi/brewery/De8Q5F/upload_BrArvM-large.png","verified","Verified","2012-01-03 02:41:33","2014-07-23 19:11:34","8665 N Sheridan Bvld","","Westminster","Colorado","80003","303-426-1976","","39.8536985","-105.0529843","N","N","N","Y","restaurant","Restaurant/Ale House","US","2001","United States","USA","","","","","",""
"RzRrsp","","","http://www.theyakandyeti.com/","","","","","","verified","Verified","2012-01-03 02:41:33","2014-07-23 19:11:34","7803 Ralston Road","","Arvada","Colorado","80002","303-431-9000","Mon - Sat: 11:00 am - 9:30 pm  Sun: 11:00 am - 9:00 pm","39.802325","-105.084091","Y","N","N","Y","brewpub","Brewpub","US","2008","United States","USA","","","","","",""
"O0JDg5","Yakima Craft Brewing Co.","Yakima Craft Brewing Co. is a craft beer brewery located in the heart of North America's leading producer of hops, the Yakima Valley in the state of Washington. We produce high-quality craft ales and lagers with an emphasis on full-bodied taste and unique character.     YCBC labels are available in the greater Yakima Valley and in many locations in the state of Washington (and occasionally, beyond).","http://www.yakimacraftbrewing.com/","","N","https://s3.amazonaws.com/brewerydbapi/brewery/ey4s2u/upload_TqFwzI-icon.png","https://s3.amazonaws.com/brewerydbapi/brewery/ey4s2u/upload_TqFwzI-medium.png","https://s3.amazonaws.com/brewerydbapi/brewery/ey4s2u/upload_TqFwzI-large.png","verified","Verified","2012-01-03 02:41:33","2014-07-23 19:11:34","2920 River Road (#6)","","Yakima","Washington","98902","509-654-7357","Mon - Thu:	4:00 pm - 8:00 pm  Fri:	3:00 pm - 8:00 pm  Sat:	1:00 pm - 10:00 pm","46.617979","-120.548065","Y","N","N","Y","micro","Micro Brewery","US","","United States","USA","","","","","",""
"yuU9MN","Yaletown Brewing","The Yaletown Brewing Company is Vancouver's original and best Brewpub. Founded in 1994, just as the former warehouse district of Yaletown was just beginning to emerge as a destination for businesses and residents, the YBC was built with the vision of being a true neighbourhood pub - a welcoming gathering place whether you arrived dressed in a suit or flip-flops.","http://www.markjamesgroup.com/yaletown.html","1994","N","","","","verified","Verified","2012-01-03 02:41:33","2014-07-23 19:11:34","1111 Mainland Street","","Vancouver","British Columbia","V6B 2T9","604-688-0039","Sun - 11:30am - Midnight  Mon - 11:30am - Midnight  Tues - 11:30am - Midnight  Wed - 11:30am - Midnight  Thur - 11:30am - 1am  Fri - 11:30am - 3am  Sat - 11:30am - 3am","49.2754449","-123.1207075","Y","N","N","Y","brewpub","Brewpub","CA","1994","Canada","CAN","124","","","","",""
"5h2wiE","Yalobusha Brewing Company","Brewed In The Red Clay Hills Of North Mississippi","http://www.yalobushabrewing.com","","N","https://s3.amazonaws.com/brewerydbapi/brewery/rFWqUe/upload_sGv7uO-icon.png","https://s3.amazonaws.com/brewerydbapi/brewery/rFWqUe/upload_sGv7uO-medium.png","https://s3.amazonaws.com/brewerydbapi/brewery/rFWqUe/upload_sGv7uO-large.png","verified","Verified","2012-01-03 02:41:33","2014-07-23 19:11:34","102 South Main","","Water Valley","Mississippi","38965","(855) 925-6273","Mon - Sat: 9:00 am - 6:00 pm","34.1445677","-89.6353293","Y","N","N","Y","micro","Micro Brewery","US","","United States","USA","","","","","",""
"bECxVo","Yamhill Brewing","","","","N","","","","verified","Verified","2012-01-03 02:41:33","2014-07-23 19:11:34","","","Portland","Oregon","","","","45.511795","-122.675629","Y","N","N","Y","micro","Micro Brewery","US","","United States","USA","","","","","",""
"T5fkoD","Yard Owl Craft Brewery","YARD OWL ales are brewed in a traditional European style. Hand crafted exclusivly by James Walsh and Kristop Brown, YARD OWL brews will be available at fine pubs, bodegas, farm markets, and local stores in the summer of 2012, the dawn of wisdom (by the pint.)","http://www.yardowlcraftbrewery.com/","2012","N","https://s3.amazonaws.com/brewerydbapi/brewery/KElhLo/upload_uW4SDM-icon.png","https://s3.amazonaws.com/brewerydbapi/brewery/KElhLo/upload_uW4SDM-medium.png","https://s3.amazonaws.com/brewerydbapi/brewery/KElhLo/upload_uW4SDM-large.png","verified","Verified","2012-01-03 02:41:33","2014-07-23 19:11:34","","","New Paltz","New York","","(845) 633-1325","","41.746115","-74.078459","Y","Y","N","Y","micro","Micro Brewery","US","","United States","USA","","","","","",""
"DXvlfF","Yards Brewing Company","In 1988, two cash-strapped collegiate wrestlers realized that they could sustain their thirst for quality beer without spending their modest savings at the local liquor store by brewing beer themselves. So began the friendship of Tom Kehoe and Jon Bovit.    As they made their way through college they continued to experiment with homebrewing and formulating new recipes. Proud of their product, they were eager to share it with friends. An instant favorite, it wasn't long until they realized their modest homebrewing operation wasn't going to be enough to satisfy the growing demand.    During the early 1990s, many breweries opened, and craft brewing started to gain popularity. Working in a small English-style brewery in Western Maryland, Tom Kehoe and Jon Bovit decided to take matters into their own hands, and in 1994, they founded Yards Brewing Company.","http://www.yardsbrewing.com/","1994","N","https://s3.amazonaws.com/brewerydbapi/brewery/jwWiTH/upload_pXUGPy-icon.png","https://s3.amazonaws.com/brewerydbapi/brewery/jwWiTH/upload_pXUGPy-medium.png","https://s3.amazonaws.com/brewerydbapi/brewery/jwWiTH/upload_pXUGPy-large.png","verified","Verified","2012-01-03 02:41:33","2014-07-23 19:11:34","901 N. Delaware Avenue","","Philadelphia","Pennsylvania","19123","215-634-2600","Mon: 12:00 pm - 7:00 pm  Tues - Wed: 12:00 am - 7:00 pm  Thurs - Sat: 12:00 pm - 7:00 pm  Sun: 12:00 pm - 4:00 pm","39.962616","-75.136253","Y","N","N","Y","micro","Micro Brewery","US","1994","United States","USA","","","","","",""
"preZog","Yazoo Brewing Company","Yazoo Brewing began as just a dream, stoked by years of homebrewing in the basement. Linus and Lila Hall moved to Nashville from Mississippi in 1996, with Linus going to work as a tire engineer for Bridgestone and Lila as a curator for the Parthenon. Trying to make tires more round proved to be less fulfilling than making great beer, so with the encouragement of Lila, Linus quit his job, got a business degree from Vanderbilt and a craft-brewing education through a course at the American Brewer's Guild, and did an internship under Garrett Oliver at Brooklyn Brewery. Linus found a used 10 bbl brewing system from a brewpub in Iowa that had gone out of business, and went to work restoring a corner of the old Marathon Motorworks building for their brewery. Yazoo Brewing opened for business in Oct 2003, and quickly gained an enthusiastic local following.","http://www.yazoobrew.com/","2003","N","https://s3.amazonaws.com/brewerydbapi/brewery/gUJBgl/upload_P8vokp-icon.png","https://s3.amazonaws.com/brewerydbapi/brewery/gUJBgl/upload_P8vokp-medium.png","https://s3.amazonaws.com/brewerydbapi/brewery/gUJBgl/upload_P8vokp-large.png","verified","Verified","2012-01-03 02:41:33","2014-08-23 15:00:53","910 Division St","","Nashville","Tennessee","37203","615-891-4649","Thu:  4:00pm - 8:00pm Fri:  4:00pm - 8:00pm Sat:  2:00pm - 8:00pm Wed:  4:00pm - 6:00pm  Wednesday are Growler fills only","36.1509754","-86.7821302","Y","N","N","Y","micro","Micro Brewery","US","2003","United States","USA","","","","","",""
"b80J5o","Yeastie Boys","","http://www.yeastieboys.co.nz/","2008","N","","","","verified","Verified","2012-01-03 02:41:33","2014-07-23 19:11:34","","","","Wellington","","(27) 4186639","","-41.280515","174.767121","Y","N","N","Y","micro","Micro Brewery","NZ","2008","New Zealand","NZL","554","","","","",""
"4JAg2G","Dallas","","","","N","","","","verified","Verified","2012-01-03 02:41:33","2014-07-23 19:11:34","2920 North Henderson Ave","","Dallas","Texas","75206","214-824-2739","","32.820959","-96.784845","Y","N","N","N","micro","Micro Brewery","US","","United States","USA","","","","","",""
"SBNNy7","Yellow House Canyon Brew Works","YHCBW is a production brewery, sitting on the edge of our namesake, bringing craft brewing to the plains in an exciting way. Saddle up and help us bring this new ride to West Texas. Drink deeply and enjoy!","http://www.yellowhousecanyonbrewworks.com/","2010","N","https://s3.amazonaws.com/brewerydbapi/brewery/KKyLlo/upload_bSrWNu-icon.png","https://s3.amazonaws.com/brewerydbapi/brewery/KKyLlo/upload_bSrWNu-medium.png","https://s3.amazonaws.com/brewerydbapi/brewery/KKyLlo/upload_bSrWNu-large.png","verified","Verified","2012-01-03 02:41:33","2014-07-23 19:11:34","601 North University Ave.","","Lubbock","Texas","79415","806-744-1917","","33.6052477","-101.870499","Y","N","N","Y","micro","Micro Brewery","US","2010","United States","USA","","","","","",""
"nrqMKx","Yellow Springs Brewery","Yellow Springs Brewery is about creating more than just great tasting beer. We’re about Crafting Truth To Power. It’s a pretty simple concept, one that holds within it the purpose of self-expression and the promise of a stronger community.","http://yellowspringsbrewery.com","","N","https://s3.amazonaws.com/brewerydbapi/brewery/CYcZRc/upload_ut3YQZ-icon.png","https://s3.amazonaws.com/brewerydbapi/brewery/CYcZRc/upload_ut3YQZ-medium.png","https://s3.amazonaws.com/brewerydbapi/brewery/CYcZRc/upload_ut3YQZ-large.png","verified","Verified","2012-01-03 02:41:33","2014-07-23 19:11:34","305 Walnut St","","Yellow Springs","Ohio","45387","(937) 767-0222","Wednesday through Friday 3-10pm  Saturday 1-10pm  Sunday 1-6pm","39.8101503","-83.8898334","Y","N","N","Y","micro","Micro Brewery","US","","United States","USA","","","","","",""
"lKOz9F","Yellow Truck Brewing Company","Yellow Truck Brewing Company's owners, Ross and Amanda Franklin, aspire to have their brewery be among Asheville's great craft breweries!","http://yellowtruckbrewingcompany.com/","","N","","","","verified","Verified","2012-01-03 02:41:33","2014-07-23 19:11:34","4 Marjorie Street","","Asheville","North Carolina","28801","828-712-3546","","35.594923","-82.549525","Y","Y","N","Y","micro","Micro Brewery","US","","United States","USA","","","","","",""
"plRvOg","YellowBelly Brewery & Public House","","http://www.yellowbellybrewery.com/","","N","","","","verified","Verified","2012-01-03 02:41:33","2014-07-23 19:11:34","288 Water Street & 1 George Street","","St. John's","Newfoundland","A1C 1B7","709 757 3784","","47.56238","-52.70915","Y","N","N","Y","micro","Micro Brewery","CA","","Canada","CAN","124","","","","",""
"4V6C7Y","Yellowhammer Brewery","Launched in late 2010 in downtown Huntsville, Yellowhammer Brewing seeks to bring Belgian and German tradition to Alabama. That means Euopean styles, but with a slight Southern interpretation.  Thanks to Free the Hops and the change in Alabama's formerly restrictive beer laws, creativity in brewing has come to Alabama.    At Yellowhammer, head brewer Keith Yager draws inspiration from both Belgian and German brewing traditions. An accomplished home brewer since 1995, Yager has designed numerous seasonal and specialty batches, from the Dark Hammer Belgian Quad to the UberAlt sticke ale. Other recurring ales are more experimental, blending styles, as with Tobacco Road, an imperial amber designed to complement a good cigar, or the occasional Lonesome Hop series, which spotlights the character of an individual hop. Yellowhammer is Yager's first commercial undertaking.    Yellowhammer Brewing opened on Oct. 16, 2010 with the best-selling Belgian white ale and the IPA. Other staples sold throughout the year include a German style altbier and the Miracle Worker, a potent Belgian tripel.","http://www.yellowhammerbrewery.com/","2010","N","https://s3.amazonaws.com/brewerydbapi/brewery/BI8mE7/upload_h0FCyk-icon.png","https://s3.amazonaws.com/brewerydbapi/brewery/BI8mE7/upload_h0FCyk-medium.png","https://s3.amazonaws.com/brewerydbapi/brewery/BI8mE7/upload_h0FCyk-large.png","verified","Verified","2012-01-03 02:41:33","2014-07-23 19:11:34","2406 Clinton Avenue","","West Huntsville","Alabama","35805","256-975-5950","","34.722525","-86.603703","Y","N","N","Y","micro","Micro Brewery","US","2010","United States","USA","","","","","",""
"VXOGKd","Yellowhead Brewery","","http://www.yellowheadbrewery.com/","","N","","","","verified","Verified","2012-01-03 02:41:33","2014-07-23 19:11:34","10229 105 St NW","","Edmonton","Alberta","T5J 3L5","780-423-3333","","53.543531","-113.501064","Y","N","N","Y","micro","Micro Brewery","KH","","Cambodia","KHM","116","","","","",""
"gop0Gz","Yellowstone Valley Brewing Co.","The Yellowstone Valley Brewery is located near the historic downtown district of Billings, Montana. All our ales are hand brewed under the watchful eye of Chief Brewer, George Moncure, brewed by Caleb Lausch and Ryan Koga, and served to you by all of us with Tap Room manager Donnie Veltri.    All our fermenting tanks are computer temperature controlled to keep the yeast happy! All brews are monitored for the correct carbonation content, and then immediately bottled to ensure the freshest, best tasting beer possible!","http://www.yellowstonevalleybrew.com/","","N","https://s3.amazonaws.com/brewerydbapi/brewery/4AaNXK/upload_S7dQ4E-icon.png","https://s3.amazonaws.com/brewerydbapi/brewery/4AaNXK/upload_S7dQ4E-medium.png","https://s3.amazonaws.com/brewerydbapi/brewery/4AaNXK/upload_S7dQ4E-large.png","verified","Verified","2012-01-03 02:41:33","2014-07-23 19:11:34","2123B 1st Ave N","","Billings","Montana","59101","406-245-0918","","45.7860789","-108.4978757","Y","N","N","Y","micro","Micro Brewery","US","","United States","USA","","","","","",""
"rRSMZw","Production Facility","Yes Face Beer: Real Ale made in Georgia. Available in Cask or Keg    Gypsy brewer Mark Broe will be creating his British-style session ale in cask and keg form while looking for a place in Georgia to relocate his 8-barrel cask ale system.  Available from your distributors: Leon Farmer, Atlanta Beverage, and Eagle Rock.","","","N","https://s3.amazonaws.com/brewerydbapi/brewery/FJf4Vn/upload_ElYpdQ-icon.png","https://s3.amazonaws.com/brewerydbapi/brewery/FJf4Vn/upload_ElYpdQ-medium.png","https://s3.amazonaws.com/brewerydbapi/brewery/FJf4Vn/upload_ElYpdQ-large.png","verified","Verified","2012-01-03 02:41:33","2014-07-23 19:11:34","111 Allium Court","","Griffin","Georgia","30223","(404) 213-3867","","33.3175312","-84.2424619","Y","N","N","Y","production","Production Facility","US","","United States","USA","","","","","",""
"kk8e8f","YesterYears Brewery","YesterYears Brewery makes Great Beer to make Great Friends while making Great Memories!!","http://www.yesteryearsbrewery.com","","N","https://s3.amazonaws.com/brewerydbapi/brewery/C4Ysr2/upload_gXy08e-icon.png","https://s3.amazonaws.com/brewerydbapi/brewery/C4Ysr2/upload_gXy08e-medium.png","https://s3.amazonaws.com/brewerydbapi/brewery/C4Ysr2/upload_gXy08e-large.png","verified","Verified","2012-01-03 02:41:33","2014-10-29 12:40:43","","","Carrboro","North Carolina","27514","(919) 649-5101","","35.9722081","-79.0475559","N","Y","N","Y","micro","Micro Brewery","US","","United States","USA","","","","","",""
"7r74U4","Yo-Ho Brewing Company","YO-HO BREWING COMPANY was established in 1996, as a subsidiary of Hoshino Resort CO., a Japanese leading resort management company. Its establishment was soon after the removal of the law, which prohibited the production of craft beer in Japan. Until then, Japanese people didn’t have “beer culture”. Almost all beers in Japan were “Lager beer” and people rarely knew about “Ale beer”. We started brewing “Ale” with an aim of letting Japanese people know rich and various tastes of Ale.","http://www.yonasato.com/","1996","N","","","","verified","Verified","2012-01-03 02:41:33","2014-07-23 19:11:34","1119-1 Otai","","Saku city","Nagano","385-0009","0267-66-1047","","36.302185","138.488319","Y","N","N","Y","micro","Micro Brewery","JP","1996","Japan","JPN","392","","","","",""
"kApsdV","Yokohama Brewery","","http://www.yokohamabeer.com/","","N","","","","verified","Verified","2012-01-03 02:41:33","2014-07-23 19:11:34","","","","","","","","","","Y","N","N","Y","micro","Micro Brewery","JP","","Japan","JPN","392","","","","",""
